{
  "schemaVersion": 1,
  "allowedLicenses": [
    "0BSD",
    "Apache-2.0",
    "BlueOak-1.0.0",
    "BSD-2-Clause",
    "BSD-3-Clause",
    "BSD-4-Clause",
    "CC-BY-4.0",
    "CC0-1.0",
    "ISC",
    "LGPL-2.1+",
    "LGPL-2.0+",
    "LicenseRef-Microsoft-DotNet-Library",
    "MIT",
    "MIT-0",
    "MPL-2.0"
  ],
  "licenseAliases": {},
  "overrides": {
    "nuget:BCrypt.Net-Next@4.0.3": "MIT",
    "nuget:Devsense.Php.Parser@8.5.17973": "Apache-2.0",
    "nuget:Devsense.PHP.Phar@1.0.40": "Apache-2.0",
    "nuget:FluentFTP@39.4.0": "MIT",
    "nuget:Isopoh.Cryptography.Argon2@1.1.10": "CC-BY-4.0",
    "nuget:Isopoh.Cryptography.Blake2b@1.1.10": "CC-BY-4.0",
    "nuget:Isopoh.Cryptography.SecureArray@1.1.10": "CC-BY-4.0",
    "nuget:Microsoft.NETCore.App@2.0.9": "LicenseRef-Microsoft-DotNet-Library",
    "nuget:Microsoft.NETCore.DotNetAppHost@2.0.9": "LicenseRef-Microsoft-DotNet-Library",
    "nuget:Microsoft.NETCore.DotNetHostPolicy@2.0.9": "LicenseRef-Microsoft-DotNet-Library",
    "nuget:Microsoft.NETCore.DotNetHostResolver@2.0.9": "LicenseRef-Microsoft-DotNet-Library",
    "nuget:Microsoft.NETFramework.ReferenceAssemblies@1.0.3": "MIT",
    "nuget:Microsoft.NETFramework.ReferenceAssemblies.net20@1.0.3": "MIT",
    "nuget:Microsoft.NETFramework.ReferenceAssemblies.net48@1.0.3": "MIT",
    "nuget:Microsoft.NETCore.Platforms@2.0.2": "LicenseRef-Microsoft-DotNet-Library",
    "nuget:Microsoft.NETCore.Platforms@1.1.0": "LicenseRef-Microsoft-DotNet-Library",
    "nuget:Mobius.ILasm@0.1.0": "MIT AND BSD-4-Clause",
    "nuget:NETStandard.Library@2.0.3": "MIT",
    "nuget:Peachpie.CodeAnalysis@1.1.13": "Apache-2.0",
    "nuget:Peachpie.Library@1.1.13": "Apache-2.0 AND BSD-3-Clause",
    "nuget:Peachpie.Runtime@1.1.13": "Apache-2.0",
    "nuget:System.Configuration.ConfigurationManager@4.5.0": "MIT",
    "nuget:System.Data.DataSetExtensions@4.5.0": "MIT",
    "nuget:System.Security.Cryptography.ProtectedData@4.5.0": "MIT"
  },
  "deniedPrefixes": ["AGPL-", "GPL-", "SSPL-"]
}
